{
  "schema_version": "1.0.0",
  "request_id": "toolreq_01HZZ0RENDERPREVIEWREQ000001",
  "tool_name": "render_preview",
  "requested_at": "2026-04-14T20:20:09Z",
  "session_id": "session_01HZZ0FIRSTSLICE0000000001",
  "asset_id": "asset_01HZZ0FIRSTSLICEASSET00000001",
  "version_id": "ver_01HZZ0FIRSTSLICEEDIT00000001",
  "caller": "agent-a-contract-fixture-track",
  "arguments": {
    "audio_version": {
      "schema_version": "1.0.0",
      "version_id": "ver_01HZZ0FIRSTSLICEEDIT00000001",
      "asset_id": "asset_01HZZ0FIRSTSLICEASSET00000001",
      "parent_version_id": "ver_01HZZ0FIRSTSLICEBASE00000001",
      "lineage": {
        "created_at": "2026-04-14T20:20:08Z",
        "created_by": "modules/transforms",
        "reason": "apply edit plan",
        "plan_id": "plan_01HZZ0FIRSTSLICEPLAN00000001",
        "transform_record_id": "transform_01HZZ0FIRSTSLICERECORD0001"
      },
      "audio": {
        "storage_ref": "storage/audio/ver_01HZZ0FIRSTSLICEEDIT00000001.wav",
        "sample_rate_hz": 44100,
        "channels": 2,
        "duration_seconds": 4,
        "frame_count": 176400,
        "channel_layout": "stereo"
      },
      "state": {
        "is_original": false,
        "is_preview": false
      }
    },
    "output_dir": "renders/previews",
    "output_file_name": "first-slice-preview.mp3",
    "render_id": "render_01HZZ0FIRSTSLICEPREVIEW00001",
    "bitrate": "192k",
    "sample_rate_hz": 44100,
    "channels": 2,
    "loudness_summary": {
      "integrated_lufs": -15,
      "true_peak_dbtp": -1.8
    }
  }
}
